{
  "schema": "openprose.runner-case/1",
  "id": "core.service-word-correction-02",
  "summary": "Pure service-word correction preserves display and program identity without native option leakage.",
  "phase": 7,
  "tags": [
    "cli",
    "correction",
    "provider-free",
    "differential"
  ],
  "controls": {
    "fixedInvocationId": "fixture-invocation-0001",
    "fixedTimestamp": "2025-01-01T00:00:00Z",
    "fixedMonotonicMs": 0,
    "network": "denied"
  },
  "invocation": {
    "argv": [
      "--output=json",
      "--no-color",
      "--verbose",
      "--harness",
      "openprose",
      "--transport",
      "hosted",
      "--timeout",
      "3m",
      "run",
      "input.prose.md"
    ],
    "cwd": "{{WORKSPACE}}",
    "environment": {}
  },
  "expected": {
    "exitCode": 10,
    "stdout": {
      "kind": "json",
      "schema": "openprose.runner-result/1"
    },
    "stderr": {
      "kind": "empty"
    },
    "startedHarness": false,
    "resultMatches": {
      "error": {
        "code": "HOSTED_UNAVAILABLE",
        "details": {
          "suggestedArgv": [
            "--output=json",
            "--no-color",
            "--verbose",
            "cli",
            "run",
            "submit",
            "input.prose.md",
            "--preview"
          ]
        }
      }
    }
  }
}
