{
  "schema": "openprose.runner-case/1",
  "id": "core.service-word-correction-07",
  "summary": "Pure service-word correction preserves display and program identity without native option leakage.",
  "phase": 7,
  "tags": [
    "cli",
    "correction",
    "provider-free",
    "differential"
  ],
  "controls": {
    "fixedInvocationId": "fixture-invocation-0001",
    "fixedTimestamp": "2025-01-01T00:00:00Z",
    "fixedMonotonicMs": 0,
    "network": "denied"
  },
  "invocation": {
    "argv": [
      "--output",
      "json",
      "--dry-run",
      "--no-color",
      "--verbose",
      "--harness",
      "openprose",
      "--transport",
      "rpc",
      "--cwd",
      "missing/../space dir",
      "--model",
      "ignored-model",
      "--auth-profile",
      "ignored-auth",
      "--permission-mode",
      "default",
      "--native-max-turns",
      "3",
      "--native-timeout",
      "2m",
      "--native-tool-timeout",
      "5s",
      "--native-output-bytes",
      "1048576",
      "--native-log",
      "private-log",
      "org",
      "list"
    ],
    "cwd": "{{WORKSPACE}}",
    "environment": {}
  },
  "expected": {
    "exitCode": 2,
    "stdout": {
      "kind": "json",
      "schema": "openprose.service-operation/1"
    },
    "stderr": {
      "kind": "empty"
    },
    "startedHarness": false,
    "resultMatches": {
      "problem": {
        "code": "INVOCATION_INVALID",
        "details": {
          "suggestedArgv": [
            "--output",
            "json",
            "--no-color",
            "--verbose",
            "cli",
            "org",
            "list"
          ]
        }
      }
    }
  }
}
